{
  "$schema": "http://json-schema.org/draft-07/schema#",
  "title": "Resume Schema",
  "description": "JSON Schema for resume-as-code resume.json validation",
  "type": "object",
  "required": ["basics"],
  "properties": {
    "basics": {
      "type": "object",
      "required": ["name", "email"],
      "properties": {
        "name": {
          "type": "string",
          "minLength": 1,
          "description": "Full name"
        },
        "label": {
          "type": "string",
          "description": "Professional label or title"
        },
        "image": {
          "type": "string",
          "description": "Profile image path"
        },
        "email": {
          "type": "string",
          "description": "Email address"
        },
        "phone": {
          "type": "string",
          "description": "Phone number"
        },
        "url": {
          "type": "string",
          "description": "Personal website URL"
        },
        "summary": {
          "type": "string",
          "description": "Professional summary"
        },
        "location": {
          "type": "object",
          "properties": {
            "city": { "type": "string" },
            "countryCode": { "type": "string", "minLength": 2, "maxLength": 2 },
            "region": { "type": "string" }
          }
        },
        "nationality": {
          "type": "string",
          "description": "Nationality"
        },
        "languages": {
          "type": "array",
          "items": { "type": "string" },
          "description": "List of languages"
        },
        "profiles": {
          "type": "array",
          "items": {
            "type": "object",
            "required": ["network", "url"],
            "properties": {
              "network": { "type": "string" },
              "username": { "type": "string" },
              "url": { "type": "string" }
            }
          },
          "description": "Social media profiles"
        }
      }
    },
    "work": {
      "type": "array",
      "items": {
        "type": "object",
        "required": ["name", "position"],
        "properties": {
          "name": { "type": "string" },
          "position": { "type": "string" },
          "url": { "type": "string" },
          "startDate": { "type": "string" },
          "endDate": { "type": "string" },
          "summary": { "type": "string" },
          "highlights": {
            "type": "array",
            "items": { "type": "string" }
          }
        }
      }
    },
    "education": {
      "type": "array",
      "items": {
        "type": "object",
        "properties": {
          "institution": { "type": "string" },
          "area": { "type": "string" },
          "studyType": { "type": "string" },
          "startDate": { "type": "string" },
          "endDate": { "type": "string" }
        }
      }
    },
    "skills": {
      "type": "array",
      "items": {
        "type": "object",
        "required": ["name"],
        "properties": {
          "name": { "type": "string" },
          "level": { "type": "string" },
          "keywords": {
            "type": "array",
            "items": { "type": "string" }
          },
          "links": {
            "type": "object",
            "additionalProperties": { 
              "type": "string" 
            }
          }
        }
      }
    },
    "projects": {
      "type": "array",
      "items": {
        "type": "object",
        "properties": {
          "name": { "type": "string" },
          "description": { "type": "string" },
          "url": { "type": "string" },
          "highlights": {
            "type": "array",
            "items": { "type": "string" }
          }
        }
      }
    },
    "certificates": {
      "type": "array",
      "items": {
        "type": "object",
        "properties": {
          "name": { "type": "string" },
          "issuer": { "type": "string" },
          "date": { "type": "string" },
          "url": { "type": "string" }
        }
      }
    }
  }
}